np;zagadnienie;redaktor
9;Postępowanie mediacyjne;Iga
23;Zasada kontradyktoryjności i zasada inkwizycyjności;Ada
36;Orzeczenia, zarządzenia i polecenia;Kamila
37;Porządek czynności procesowych;Piotr
40;Dostęp do akt sprawy karnej;Łukasz
46;Narada i głosowanie nad orzeczeniem;Alek
49;Odstępstwa od rozpoznania sprawy przez sąd właściwy. Spory o właściwość;Iga
55;Pojęcie dowodu. Źródło dowodu, środek dowodowy, fakt dowodowy;Ada
63;Zakazy dowodzenia za pomocą określonych środków dowodowych;Kamila
68;Przeszukanie - rodzaje, przesłanki i tryb postępowania;Piotr
75;Oględziny, wizja lokalna i eksperyment procesowy. Czynności kontrolujące dowody;Łukasz
81;Postępowanie Habeas Corpus. Standard konstytucyjny, konwencyjny i ustawowy;Alek
82;Zakazy stosowania tymczasowego aresztowania;Iga
95;Czynności sądowe w postępowaniu przygotowawczym;Ada
111;Cechy, granice i kierunek środka odwoławczego;Kamila
119;"Pojęcie, istota i rodzaje postępowań szczególnych; powody i kryteria ich wyodrębniania";Piotr
121;Postępowanie przyspieszone;Łukasz
129;Ekstradycja. Przesłanki i tryb postępowania;Alek
